{
	"$schema": "../schemas/out/palette.json",
	"id": "rose-pine",
	"name": "Rose Pine",
	"dark": true,
	"variables": {
		"ui": {
			"background-dark": "#191724",
			"background": "#1f1d2e",
			"background-light": "#21202e",
			"background-lighter": "#26233a",
			"border": "#6e6a86",
			"selection": "#908caa",
			"text": "#e0def4",
			"text-dark": "#908caa",
			"text-darker": "#6e6a86",
			"text-contrast": "#191724",
			"primary": "#eb6f92",
			"secondary": "#c4a7e7",
			"link": "#9ccfd8",
			"link-visited": "#c4a7e7",
			"button-border": "#000000"
		},
		"code": {
			"comment": "#1f1e33"
		}
	}
}
